{
  "watchlist_id": "asset-watchlist",
  "version": "2026.05.27-sample-valid",
  "effective_date": "2026-05-27",
  "purpose": "Valid sample for the IPC-only monitoring allowlist.",
  "assets": [
    {
      "symbol": "IPC",
      "display_name": "S&P/BMV IPC",
      "market": {
        "venue": "Bolsa Mexicana de Valores",
        "country": "MX",
        "index_family": "S&P/BMV indices"
      },
      "asset_type": "index",
      "currency": "MXN",
      "active": true,
      "notes": "Sample confirms IPC observations are represented as index points while MXN identifies market context.",
      "traceability": {
        "source_reference": "Public IPC index reference materials; no market values captured.",
        "review_rationale": "Valid example of the governed IPC-only watchlist entry."
      }
    }
  ]
}
